EventNum,SpeakNum,Speaker,Speak
86,3,"남편의 복수를 했지만 그건 내가 한 일이 아니었다. 내 몸 안에 악마가 들어와 있었던 것이다.",
86,4,"악마의 지배를 받게 되자 놈의 계획과 ",
86,5,"지금까지 우리가족에게 한 짓들을 알게 되었다.",
86,6,"악마의 마지막 목표는 나의 딸 엘리스였다.",
86,7,"난 내 목숨을 바쳐 그녀를 지켜야 한다. 다행히 악마가 잠시 다른 사람의 꿈에 간 사이에는 정신을 되찾을 수 있었다.",
87,0," 그리고 악마의 영향으로 나의 정신이 매개체를 통해 다른 사람의 꿈속에 들어갈 수 있다는 것도 알게 되었다.",
87,1," 그렇다면 인형들을 이용해서 그녀를 보호할 수 있을 것이다.",
87,2,"피할 수 없다면 싸워야 한다. ",
87,3,"난 악마에게 저항할 것이다. 놈은 내 몸과 정신을 철저히 망가뜨리고 있다. ",
87,4,"그리고 알 수 없는 주술로 이 집에서 나가지 못하도록 막고 있다.",
87,5,"꿈은 악마의 힘의 원천이다. 놈을 쓰러뜨리려면 꿈속에서 결판을 내야 한다.",
87,6,"나의 사랑스러운 딸 엘리스. ",
87,7,"부디 이겨내 다오. 엄마는 모든 걸 다해 널 지킬 거야......",
88,0,엘리스,"지금은 너무 졸려.. 다시 자는 게 좋겠어."
89,0,엘리스,"(다시 자기 전에 엄마 상태를 확인하는 게 먼저야)"
90,0, D - 1,마지막 악몽
91,0,엘리스,"...역시 밤이네.. 오늘이 마지막 밤이야.. "
91,1,엘리스,"엄마는 지금까지 나를 지키려고 그랬던 거였어... 엄마.. 오해해서 미안해요.."
91,2,엘리스,"아 참. 이럴 때가 아니지. 빨리 엄마를 데리고 이곳을 빠져나가야 돼!"
92,0,곰 인형,"엘리스.. 엄마야. 내 몸은 이제 너무 악화되어 깨어날 수가 없구나... "
92,1,곰 인형,"그래서 이렇게 인형을 통해 너에게 얘기를 전한다.."
92,2,엘리스,"엄마! 이 목소리는 분명 우리 엄마야.."
92,3,곰 인형,"오늘이 마지막 악몽의 밤이야."
92,4,곰 인형,"악마는 네 정신을 무너뜨리고 널 차지하기 위해 모든 힘을 끌어 모으고 있어. "
92,5,엘리스,"그럼 우리 빨리 도망쳐요! 악마가 쫓아올 수 없는 곳으로 어서!"
92,6,곰 인형,"도망칠 수는 없단다. 엘리스. "
92,7,곰 인형,"놈은 지금까지 흡수한 모든 영혼의 고통과 슬픔, 증오와 분노를 이끌고 네 앞에 나타날 거야.."
92,8,엘리스,"그러면… 저는 어떻게 해야 되죠?"
92,9,토끼 인형,"맞서 싸워야 해. "
92,10,토끼 인형,"엄마가 도와줄 테니 악마를 완전히 소멸시키고 잃어버렸던 너의 삶을 되찾아야 해."
92,11,엘리스,"제가 과연 할 수 있을까요? 지금까지도 너무 힘들었어요..."
92,12,토끼 인형,"엘리스, 너는 할 수 있어! 너는 내 딸이니까 나는 알 수 있어."
92,13,토끼 인형,"네 안에는 희망을 향한 큰 의지가 들어있단다."
92,14,엘리스,"그러면 엄마도 날 도와주는 거죠?"
92,15,여우 인형,"물론이야. 엄마는 마지막 순간까지 항상 네 옆에서 널 지킬 거야."
92,16,엘리스,"알았어요... 엄마를 구하기 위해서라도 이번에는 내가 먼저 악마와 맞서 싸워볼게요."
92,17,여우 인형,"고맙다 엘리스.. 넌 강한 아이란다.."
92,18,여우 인형,"엄마가 널 너무나도 사랑하고 있다는 걸 잊지 말아줘.."
92,19,엘리스,"저도 사랑해요 엄마.."
93,0, D - Day,엄마
94,0,엘리스,"오랜만에 보는 아침이야.. 아침이 이렇게 소중하게 느껴지다니.."
94,1,엘리스,"엄마 덕분에 악마를 물리칠 수 있었어.. 엄마는 괜찮을까? 어서 엄마한테 가봐야겠어!"
95,0,엘리스,"기분이 정말 상쾌해. 몸도 가볍고 지금이라도 당장 밖으로 나가서 뛰어다니고 싶어!"
95,1,엘리스,"맞다! 엄마랑 함께 오랜만에 간식을 만들어서 숲에 다녀와야겠어. 엄마도 좋아하겠지?"
96,0,엘리스,"밖으로 나가기 전에 엄마를 먼저 살펴봐야해."
97,0,엘리스,"엄마, 아직 자고 있네? 일어나봐."
97,1,엘리스,"어제 우리가 함께 악마와 싸워서 이긴 거 기억나지?"
97,2,엄마,"...엘리스..."
97,3,엄마,"다행.. 이구나..."
97,4,엘리스,"엄마.. 얼굴이 너무 창백해졌어. 목소리도 힘이 없고.."
97,5,엄마,"이제야... 편히.."
97,6,엄마,"쉴 수... 있겠어......"
97,7,엘리스,"무슨 말을 하는 거야? 몸이 많이 안 좋은 거지?"
97,8,엘리스,"조금만 기다려! 지금 바로 의사선생님을 불러올게!"
97,9,엄마,"..잠깐만..."
97,10,엄마,"엄마 말을... 들어주렴..."
97,11,엘리스,"엄마..."
97,12,엄마,"네가 살아줘서.. 엄마는 기쁘단다..."
97,13,엘리스,"이러지마 엄마..."
97,14,엘리스,"이제야 겨우 제자리로 돌아왔는데.."
97,15,엄마,"부디.. 앞으로도..."
97,16,엄마,"잘 살아.. 다오.."
97,17,엘리스,"우리 같이 잘 살면 되잖아 엄마... 엄마 없이 어떻게 살라고!"
97,18,엄마,"항상 널.."
97,19,엄마,"사랑.. 한단다..."
97,20,엘리스,"엄마.. 안돼.. 정신차려!"
97,21,엄마,"행복.. 해야 돼......"
97,22,엘리스,"제발! 조금만 더 버텨봐!"
97,23,엘리스,"엄마... 이러지마.. 제발......"
97,24,엄마,"......"
97,25,엘리스,"엄마... 엄마!!"
97,26,엄마,"......"